{
  "$schema": "https://agent-project-os.org/schemas/agent-registry-v1.schema.json",
  "active_release_id": null, "agent_id": "agent:client-pm", "candidate_release_id": null,
  "created_at": "2026-08-18T00:00:00Z", "lifecycle": "active", "name": "Client PM",
  "protocol_version": "1.0", "role_ids": ["project-pm"], "updated_at": "2026-08-18T00:00:00Z"
}
