{
  "$schema": "https://agent-project-os.org/schemas/agent-registry-v1.schema.json",
  "active_release_id": null,
  "agent_id": "agent:ceo",
  "candidate_release_id": null,
  "created_at": "2026-08-18T08:00:00Z",
  "lifecycle": "active",
  "name": "Self-hosted Agent CEO",
  "protocol_version": "1.0",
  "role_ids": ["agent-ceo"],
  "updated_at": "2026-08-18T08:00:00Z"
}
